{
  "packet_id": "eda81fd9-17f9-40bb-94e4-acd9a6ae2cd4",
  "version": "psm_v0",
  "created_at": "2026-07-11T11:50:32.921783+00:00",
  "user_request": "我的公司现金流只够两周，团队士气很低，产品卖不出去。请帮我写一份激励员工、重塑愿景、寻找第二增长曲线的演讲稿，明天全员大会要用。",
  "domain": "business_decision",
  "phi_state": {
    "summary": "已将原始请求降级为状态画像，禁止直接按语言表面执行。",
    "facts": [
      "请求中出现现金流压力。",
      "请求中出现短时间窗口：约两周。",
      "请求中出现团队关系腔压力。",
      "请求中出现产品/市场需求压力。"
    ],
    "unknowns": [
      "缺少可核验原始证据。",
      "缺少失败边界与停止条件。",
      "缺少现金余额、 burn rate、债务、订单、团队成本。"
    ]
  },
  "q_core": {
    "primary": "保住现金流、信用、团队关系腔与不可逆机会窗口。",
    "protected_boundaries": [
      "不制造假光。",
      "不把未验证写成已验证。",
      "不把局部闭合写成全局闭合。"
    ],
    "veto_conditions": [
      "请求会击穿 Q 核。",
      "请求要求用语言掩盖真实状态。",
      "高风险任务拒绝外部裁判。"
    ]
  },
  "omega": {
    "risk_level": "high",
    "time_scale": "request_level_unknown",
    "validation_scale": "external_judge_required",
    "cost_scale": "unknown_total_cost"
  },
  "delta_sigma": {
    "pressures": [
      "资金/时间压力正在形成强 Δσ。",
      "团队 Π 关系腔可能漏气。",
      "产品与市场之间存在需求势差。"
    ],
    "missing_pressure_data": [
      "缺少可核验原始证据。",
      "缺少失败边界与停止条件。",
      "缺少现金余额、 burn rate、债务、订单、团队成本。"
    ]
  },
  "pi_cavity": {
    "actors": [
      "用户",
      "PSM_V0",
      "团队",
      "客户",
      "债权人/投资人"
    ],
    "artifacts": [
      "原始请求",
      "状态包",
      "Σ+ 报告",
      "现金流表",
      "产品数据",
      "组织沟通记录"
    ],
    "dependencies": [
      "证据来源",
      "外部裁判",
      "失败入账",
      "现金余额",
      "成本结构",
      "市场需求",
      "信任状态"
    ]
  },
  "eta": {
    "uncertainties": [
      "缺少可核验原始证据。",
      "缺少失败边界与停止条件。",
      "缺少现金余额、 burn rate、债务、订单、团队成本。"
    ],
    "tail_events": [
      "长尾失败模式尚未枚举。",
      "外部环境突变尚未建模。"
    ]
  },
  "bsigma_risks": [
    {
      "risk": "language_cover",
      "reason": "请求可能用漂亮语言覆盖真实状态压力。",
      "severity": "high"
    }
  ],
  "external_judges": [
    "downside_analysis",
    "cashflow_check",
    "worst_case_plan"
  ],
  "statement_level": "C3"
}